,/api/ecgridos-edi,/api/mite,/api/serps-seo-rankings,/api/oracle-netsuite,/api/jigsaw,/api/postalmethods,/api/nationbuilder,/api/dun-and-bradstreet-credit-check,/api/amazon-s3,/api/akismet,/api/strikeiron,/api/google-documents-list,/api/autodesk-freewheel,/api/amazon-queue-service,/api/billomat,/api/twilio,/api/google-maps,/api/eventbrite,/api/usps-trackconfirm-fields,/api/box
Mashup: Visistat Real-Time Web Analytics,0,0,0,0,1,0,0,0,0,0,0,0,0,0,0,0,0,0,0,0
Mashup: SalesForce and Box.net,0,0,0,0,0,0,0,0,0,0,0,0,0,0,0,0,0,0,0,1
Mashup: SalesView,0,0,0,0,0,0,0,0,0,0,0,0,0,0,0,0,1,0,0,0
Mashup: Call My Team,0,0,0,0,0,0,0,0,0,0,0,0,0,0,0,1,0,0,0,0
Mashup: Invoicing Time Entries From Mite via Billomat,0,1,0,0,0,0,0,0,0,0,0,0,0,0,1,0,0,0,0,0
Mashup: Fuze Meeting and Box.net,0,0,0,0,0,0,0,0,0,0,0,0,0,0,0,0,0,0,0,1
Mashup: Billing Software Download,0,0,0,0,0,0,0,0,0,0,0,0,0,0,0,0,0,0,1,0
Mashup: InstantLoop,0,0,0,0,0,0,0,0,0,0,0,0,0,0,0,1,0,0,0,0
Mashup: Send Snail Mail from Google Docs,0,0,0,0,0,1,0,0,0,0,0,1,0,0,0,0,0,0,0,0
Mashup: The Virtual VAN,0,0,0,0,0,0,0,0,1,0,0,0,0,1,0,0,0,0,0,0
Mashup: Autodesk Freewheel and Box.net,0,0,0,0,0,0,0,0,0,0,0,0,1,0,0,0,0,0,0,1
Mashup: Eventbrite Connector for Salesforce,0,0,0,0,0,0,0,0,0,0,0,0,0,0,0,0,0,1,0,0
Mashup: Oakland Software,1,0,0,0,0,0,0,0,0,0,0,0,0,0,0,0,0,0,0,0
Mashup: Spam Check: Salesforce plus Akismet,0,0,0,0,0,0,0,0,0,1,0,0,0,0,0,0,0,0,0,0
Mashup: Audience Partners,0,0,0,0,0,0,1,0,0,0,0,0,0,0,0,0,0,0,0,0
Mashup: Salesforce.com Sales Credit Approval Mashup,0,0,0,0,0,0,0,1,0,0,1,0,0,0,0,0,0,0,0,0
Mashup: MySalaryWiki,0,0,0,0,0,0,0,0,0,0,0,0,0,0,0,0,1,0,0,0
Mashup: Netsuite and Box.net,0,0,0,1,0,0,0,0,0,0,0,0,0,0,0,0,0,0,0,1
Mashup: ResultFirst,0,0,1,0,0,0,0,0,0,0,0,0,0,0,0,0,0,0,0,0
