,/api/google-search,/api/twitter,/api/alexa-web-information-service,/api/delicious-0,/api/mozscape,/api/alexa-top-sites,/api/alchemyapi-text-categorization,/api/whois,/api/google-chart,/api/bing-search,/api/flickr,/api/yahoo-search,/api/ahrefs,/api/compete,/api/internet-archive,/api/alchemyapi-keyword-and-term-extraction,/api/thesaurus,/api/yahoo-search-marketing,/api/seomoz,/api/yahoo-site-explorer,/api/crunchbase,/api/mailchimp,/api/semrush,/api/sendgrid,/api/google-page-speed-online,/api/google-adsense,/api/semrush-traffic-analytics,/api/google-adwords,/api/lighthouse,/api/digg
Mashup: Article Optimizer,0,0,0,0,0,0,1,0,0,0,1,0,0,0,0,0,0,0,0,0,0,1,0,1,0,0,0,0,0,0
Mashup: Marketing Intelligence Console,1,1,0,0,0,0,0,0,0,0,0,1,0,0,0,0,0,1,0,0,1,0,0,0,0,1,0,1,0,1
Mashup: Backlink Checker,0,0,0,0,0,0,0,0,0,0,0,0,1,0,0,0,0,0,0,0,0,0,0,0,0,0,0,0,0,0
Mashup: Sitechecker,0,0,0,0,0,0,0,0,0,0,0,0,0,0,0,0,0,0,0,0,0,0,0,0,1,0,0,0,0,0
Mashup: Website Traffic Estimator,0,0,0,0,0,0,0,0,0,0,0,0,0,0,0,0,0,0,0,0,0,0,0,0,0,0,1,0,0,0
Mashup: SEO Audit Tool,0,0,0,0,1,0,0,0,0,0,0,0,1,0,0,0,0,0,0,0,0,0,1,0,0,0,0,0,0,0
Mashup: Bulk Google Rank Checker,0,0,0,0,0,0,0,0,0,0,0,0,0,0,0,0,0,0,0,0,0,0,1,0,0,0,0,0,0,0
Mashup: SEO Keyword suggestion Tool,1,0,0,0,0,0,0,0,0,1,0,0,0,0,0,0,1,0,0,0,0,0,0,0,0,0,0,0,0,0
Mashup: Google SEO Checker,0,0,0,0,0,0,0,0,0,0,0,0,0,0,0,0,0,0,0,0,0,0,0,0,0,0,0,0,1,0
Mashup: RealWebStats,0,0,0,0,0,0,0,1,0,0,0,0,0,0,0,0,0,0,1,0,0,0,0,0,0,0,0,0,0,0
Mashup: Website Authority Checker,0,0,0,0,0,0,0,0,0,0,0,0,0,0,1,0,0,0,1,0,0,0,0,0,0,0,0,0,0,0
Mashup: Domains by Topic via Delexa.org,0,0,0,1,0,1,0,0,0,0,0,0,0,0,0,0,0,0,0,0,0,0,0,0,0,0,0,0,0,0
Mashup: SEO Site Comparison,1,0,1,0,0,0,0,0,1,0,0,0,0,1,0,1,0,0,1,1,0,0,0,0,0,0,0,0,0,0
